{
  "schema_version": "run-result-v0.1",
  "run_id": "RUN-contract-smoke-001",
  "protocol_version": "gen0-v0.1",
  "benchmark_id": "gen0-sealed-structure-v0.1",
  "created_at": "2026-08-17T12:00:00Z",
  "finished_at": null,
  "status": "queued",
  "verdict": "pending",
  "execution": {
    "mode": "growing_library",
    "seed": 104729,
    "learner_contract_id": "learner-contract-gen0-v0.1",
    "primitive_manifest_id": "primitive-manifest-gen0-p0-v0.1"
  },
  "reproducibility": {
    "code_hash": "0000000000000000000000000000000000000000000000000000000000000000",
    "config_hash": "0000000000000000000000000000000000000000000000000000000000000000",
    "data_hash": "0000000000000000000000000000000000000000000000000000000000000000",
    "verifier_hash": "0000000000000000000000000000000000000000000000000000000000000000"
  },
  "metrics": {
    "programs_evaluated": 0,
    "maximum_search_depth": 0,
    "candidate_count": 0,
    "admitted_count": 0,
    "bounded_count": 0,
    "rejected_count": 0,
    "counterexample_count": 0
  },
  "gates": [],
  "artifacts": []
}

